{
  "schema_version": "1.0",
  "meta": {
    "dataset_id": "fictional-aisle-warehouse",
    "site_id": "SITE-FICTIONAL-AISLE",
    "period_start": "2026-04-02T00:00:00+02:00",
    "period_end": "2026-04-08T23:59:59+02:00",
    "distance_unit": "m",
    "time_zone": "Europe/Berlin",
    "source": "Fictional aisle warehouse generated for a landing-page spaghetti diagram. Not derived from a commercial floor-plan image.",
    "fictional": true,
    "sequence_basis": "planned",
    "distance_basis": "declared_graph_shortest_path"
  },
  "layout": {
    "nodes": [
      {
        "node_id": "RECV",
        "x_m": 30.0,
        "y_m": 46.0,
        "node_type": "receiving",
        "zone_id": "Z-IN"
      },
      {
        "node_id": "PACK",
        "x_m": 40.0,
        "y_m": 3.0,
        "node_type": "packing",
        "zone_id": "Z-OUT"
      },
      {
        "node_id": "SHIP",
        "x_m": 30.0,
        "y_m": 0.0,
        "node_type": "shipping",
        "zone_id": "Z-OUT"
      },
      {
        "node_id": "OUT",
        "x_m": 30.0,
        "y_m": 3.0,
        "node_type": "junction",
        "zone_id": "Z-OUT"
      },
      {
        "node_id": "AN",
        "x_m": 10.0,
        "y_m": 38.0,
        "node_type": "junction",
        "zone_id": "Z-PICK"
      },
      {
        "node_id": "AS",
        "x_m": 10.0,
        "y_m": 8.0,
        "node_type": "junction",
        "zone_id": "Z-PICK"
      },
      {
        "node_id": "A30",
        "x_m": 10.0,
        "y_m": 30.0,
        "node_type": "location_access",
        "zone_id": "Z-PICK"
      },
      {
        "node_id": "A22",
        "x_m": 10.0,
        "y_m": 22.0,
        "node_type": "location_access",
        "zone_id": "Z-PICK"
      },
      {
        "node_id": "A14",
        "x_m": 10.0,
        "y_m": 14.0,
        "node_type": "location_access",
        "zone_id": "Z-PICK"
      },
      {
        "node_id": "BN",
        "x_m": 20.0,
        "y_m": 38.0,
        "node_type": "junction",
        "zone_id": "Z-PICK"
      },
      {
        "node_id": "BS",
        "x_m": 20.0,
        "y_m": 8.0,
        "node_type": "junction",
        "zone_id": "Z-PICK"
      },
      {
        "node_id": "B30",
        "x_m": 20.0,
        "y_m": 30.0,
        "node_type": "location_access",
        "zone_id": "Z-PICK"
      },
      {
        "node_id": "B22",
        "x_m": 20.0,
        "y_m": 22.0,
        "node_type": "location_access",
        "zone_id": "Z-PICK"
      },
      {
        "node_id": "B14",
        "x_m": 20.0,
        "y_m": 14.0,
        "node_type": "location_access",
        "zone_id": "Z-PICK"
      },
      {
        "node_id": "CN",
        "x_m": 30.0,
        "y_m": 38.0,
        "node_type": "junction",
        "zone_id": "Z-PICK"
      },
      {
        "node_id": "CS",
        "x_m": 30.0,
        "y_m": 8.0,
        "node_type": "junction",
        "zone_id": "Z-PICK"
      },
      {
        "node_id": "C30",
        "x_m": 30.0,
        "y_m": 30.0,
        "node_type": "location_access",
        "zone_id": "Z-PICK"
      },
      {
        "node_id": "C22",
        "x_m": 30.0,
        "y_m": 22.0,
        "node_type": "location_access",
        "zone_id": "Z-PICK"
      },
      {
        "node_id": "C14",
        "x_m": 30.0,
        "y_m": 14.0,
        "node_type": "location_access",
        "zone_id": "Z-PICK"
      },
      {
        "node_id": "DN",
        "x_m": 40.0,
        "y_m": 38.0,
        "node_type": "junction",
        "zone_id": "Z-PICK"
      },
      {
        "node_id": "DS",
        "x_m": 40.0,
        "y_m": 8.0,
        "node_type": "junction",
        "zone_id": "Z-PICK"
      },
      {
        "node_id": "D30",
        "x_m": 40.0,
        "y_m": 30.0,
        "node_type": "location_access",
        "zone_id": "Z-PICK"
      },
      {
        "node_id": "D22",
        "x_m": 40.0,
        "y_m": 22.0,
        "node_type": "location_access",
        "zone_id": "Z-PICK"
      },
      {
        "node_id": "D14",
        "x_m": 40.0,
        "y_m": 14.0,
        "node_type": "location_access",
        "zone_id": "Z-PICK"
      },
      {
        "node_id": "EN",
        "x_m": 50.0,
        "y_m": 38.0,
        "node_type": "junction",
        "zone_id": "Z-PICK"
      },
      {
        "node_id": "ES",
        "x_m": 50.0,
        "y_m": 8.0,
        "node_type": "junction",
        "zone_id": "Z-PICK"
      },
      {
        "node_id": "E30",
        "x_m": 50.0,
        "y_m": 30.0,
        "node_type": "location_access",
        "zone_id": "Z-PICK"
      },
      {
        "node_id": "E22",
        "x_m": 50.0,
        "y_m": 22.0,
        "node_type": "location_access",
        "zone_id": "Z-PICK"
      },
      {
        "node_id": "E14",
        "x_m": 50.0,
        "y_m": 14.0,
        "node_type": "location_access",
        "zone_id": "Z-PICK"
      }
    ],
    "edges": [
      {
        "edge_id": "E-AN-A30",
        "from_node": "AN",
        "to_node": "A30",
        "distance_m": 8.0,
        "bidirectional": true,
        "allowed_modes": [
          "pedestrian",
          "forklift"
        ]
      },
      {
        "edge_id": "E-A30-A22",
        "from_node": "A30",
        "to_node": "A22",
        "distance_m": 8.0,
        "bidirectional": true,
        "allowed_modes": [
          "pedestrian",
          "forklift"
        ]
      },
      {
        "edge_id": "E-A22-A14",
        "from_node": "A22",
        "to_node": "A14",
        "distance_m": 8.0,
        "bidirectional": true,
        "allowed_modes": [
          "pedestrian",
          "forklift"
        ]
      },
      {
        "edge_id": "E-A14-AS",
        "from_node": "A14",
        "to_node": "AS",
        "distance_m": 6.0,
        "bidirectional": true,
        "allowed_modes": [
          "pedestrian",
          "forklift"
        ]
      },
      {
        "edge_id": "E-BN-B30",
        "from_node": "BN",
        "to_node": "B30",
        "distance_m": 8.0,
        "bidirectional": true,
        "allowed_modes": [
          "pedestrian",
          "forklift"
        ]
      },
      {
        "edge_id": "E-B30-B22",
        "from_node": "B30",
        "to_node": "B22",
        "distance_m": 8.0,
        "bidirectional": true,
        "allowed_modes": [
          "pedestrian",
          "forklift"
        ]
      },
      {
        "edge_id": "E-B22-B14",
        "from_node": "B22",
        "to_node": "B14",
        "distance_m": 8.0,
        "bidirectional": true,
        "allowed_modes": [
          "pedestrian",
          "forklift"
        ]
      },
      {
        "edge_id": "E-B14-BS",
        "from_node": "B14",
        "to_node": "BS",
        "distance_m": 6.0,
        "bidirectional": true,
        "allowed_modes": [
          "pedestrian",
          "forklift"
        ]
      },
      {
        "edge_id": "E-CN-C30",
        "from_node": "CN",
        "to_node": "C30",
        "distance_m": 8.0,
        "bidirectional": true,
        "allowed_modes": [
          "pedestrian",
          "forklift"
        ]
      },
      {
        "edge_id": "E-C30-C22",
        "from_node": "C30",
        "to_node": "C22",
        "distance_m": 8.0,
        "bidirectional": true,
        "allowed_modes": [
          "pedestrian",
          "forklift"
        ]
      },
      {
        "edge_id": "E-C22-C14",
        "from_node": "C22",
        "to_node": "C14",
        "distance_m": 8.0,
        "bidirectional": true,
        "allowed_modes": [
          "pedestrian",
          "forklift"
        ]
      },
      {
        "edge_id": "E-C14-CS",
        "from_node": "C14",
        "to_node": "CS",
        "distance_m": 6.0,
        "bidirectional": true,
        "allowed_modes": [
          "pedestrian",
          "forklift"
        ]
      },
      {
        "edge_id": "E-DN-D30",
        "from_node": "DN",
        "to_node": "D30",
        "distance_m": 8.0,
        "bidirectional": true,
        "allowed_modes": [
          "pedestrian",
          "forklift"
        ]
      },
      {
        "edge_id": "E-D30-D22",
        "from_node": "D30",
        "to_node": "D22",
        "distance_m": 8.0,
        "bidirectional": true,
        "allowed_modes": [
          "pedestrian",
          "forklift"
        ]
      },
      {
        "edge_id": "E-D22-D14",
        "from_node": "D22",
        "to_node": "D14",
        "distance_m": 8.0,
        "bidirectional": true,
        "allowed_modes": [
          "pedestrian",
          "forklift"
        ]
      },
      {
        "edge_id": "E-D14-DS",
        "from_node": "D14",
        "to_node": "DS",
        "distance_m": 6.0,
        "bidirectional": true,
        "allowed_modes": [
          "pedestrian",
          "forklift"
        ]
      },
      {
        "edge_id": "E-EN-E30",
        "from_node": "EN",
        "to_node": "E30",
        "distance_m": 8.0,
        "bidirectional": true,
        "allowed_modes": [
          "pedestrian",
          "forklift"
        ]
      },
      {
        "edge_id": "E-E30-E22",
        "from_node": "E30",
        "to_node": "E22",
        "distance_m": 8.0,
        "bidirectional": true,
        "allowed_modes": [
          "pedestrian",
          "forklift"
        ]
      },
      {
        "edge_id": "E-E22-E14",
        "from_node": "E22",
        "to_node": "E14",
        "distance_m": 8.0,
        "bidirectional": true,
        "allowed_modes": [
          "pedestrian",
          "forklift"
        ]
      },
      {
        "edge_id": "E-E14-ES",
        "from_node": "E14",
        "to_node": "ES",
        "distance_m": 6.0,
        "bidirectional": true,
        "allowed_modes": [
          "pedestrian",
          "forklift"
        ]
      },
      {
        "edge_id": "E-NC-AN-BN",
        "from_node": "AN",
        "to_node": "BN",
        "distance_m": 10.0,
        "bidirectional": true,
        "allowed_modes": [
          "pedestrian",
          "forklift"
        ]
      },
      {